{
  "$schema": "https://json-schema.org/draft/2020-12/schema",
  "$id": "https://local.invalid/personal_campaign/trade_intent.schema.json",
  "title": "TradeIntent",
  "type": "object",
  "additionalProperties": false,
  "required": [
    "decision",
    "strategy_contract_id",
    "campaign_id",
    "session_id",
    "direction",
    "action",
    "trigger_reason",
    "invalidation_reason",
    "evidence_text",
    "no_exchange_side_effect"
  ],
  "properties": {
    "decision": { "type": "string", "enum": ["allow", "reject"] },
    "strategy_contract_id": { "type": "string", "minLength": 1 },
    "campaign_id": { "type": "string", "minLength": 1 },
    "session_id": { "type": "string", "minLength": 1 },
    "direction": { "type": ["string", "null"], "enum": ["LONG", "SHORT", null] },
    "action": { "type": "string", "enum": ["enter", "exit", "reduce", "none"] },
    "trigger_reason": { "type": "string", "minLength": 1 },
    "invalidation_reason": { "type": ["string", "null"] },
    "evidence_text": { "type": ["string", "null"] },
    "no_exchange_side_effect": { "type": "boolean", "const": true, "default": true }
  }
}
