{
  "decision": "allow",
  "strategy_contract_id": "SQ02_DOWNSIDE_CONT_V0",
  "campaign_id": "campaign-local-001",
  "session_id": "session-sq02-local-001",
  "direction": "SHORT",
  "action": "enter",
  "trigger_reason": "setup_present",
  "invalidation_reason": null,
  "evidence_text": "deterministic_contract_conditions_satisfied",
  "no_exchange_side_effect": true
}
